<?xml version="1.0" standalone="no" ?>
<!DOCTYPE pov SYSTEM "/usr/share/cgc-docs/replay.dtd">
<pov>
<cbid>service</cbid>
<replay>
    <write><data>\x04\x04\x00\x00</data></write>
    <write><data>\x01\x00\x00\x00\x00\x00\x00\x00\xf0\x03\x00\x00\xe8\x03\x00\x00\x00\x00\x00\x00\x00\x00\x00\x00\xe8\x03\x00\x00\xf3\xef\x04\x0a\xcfl\xf28\x97\x05\x26?\x7c\x197\xe1\x9b\x11q\xfe\xda\x00\x00\x00\x40\x1d\xd99\x93J\xaa\xe4pq\x01\x3e\xe7\x94\x83\xd3\xb4L5\xc2g\xe3uf\xc2\x7d\xf2\x96\xa5\xd8\x14 \x83\xf9J\xfcgCA\x0c\xc5n\xb6\x0e\xa8\xf0:\x8a8\x05\xe4\xd7\xcdF\xa6kl\x19s\x5e\x16\xb6\xc2k\xfbn5\xb6\xe9\x1d\xe8\x60b\xed\xcf\x7d5\x9eS\xcf\xce\x40\x0c\x03uH\x91\xad\xad\x87M\xc28z\xc4\x3ce\x96\xf2\x05\x97:\x17\x1bd\xd3\xbe\x07\x83\x10\xf4\xcd\xddN\x95C\xfa\xe3\x8c\xfd\xd7\xa8DV\x0a\x1a\xdcM\x60\xd9x\xe7\x7c\xbf\xa5\x13\xf4\x3d \xc4\xf0\x84\x5e\x1a\xec\xa4\x91TD\x60\x40\xb9\xb7\xc4\xae\x2c\x0eO\x7bnN\x8et\xea\x12\x8b\x8c\x7c\x8b\x09\xb5\xed\xdd\xb3\x96\x04\x80h\x18xa\xa2\xffA\x91\xed8\x8e\x8e\xb2\x3dT\x25b\xd4\xa9\x5c\x9f\x85f\xa1\xee\xdf1\xe8\xee\x5d\xcfdw\x1dL\xc0\xe9TQ\xa1k\x5d\xa4\x08\xfb\xc3\x9b\x7b\xbd2\xbb\xc9\xfc\x97D\xe6a\xd2U\xe6\xc6D.\x3c\xfc\xeb2\x8c\x18\x05\xf5\x2f\x8b\x04C9W\x02\xf7\x3b\x92\x05d\xdcVG\xbcm\x8b\x14\x88\x08nmo\xb2\x07GIE\xb9\x5fu\x02\x5f\x96\xfeV\xcf\xd4B\xd7n\x08\xb5\x8dK\x1d\x2aK\x15\x7bQ\xd1\xb3\xa8\x81\x15\xd2\xb7PP\x28\x9f\xd1\xc0\x1a\x0a\xcc\x5fm\xec\x5dE\x11\x058e\x9d\xca\x8d\x84j\x03\xd1\xff\x10\x5f\xf4\xac\xa4\xc9\xa5\x08\x00B\x7f\xeb\xd8\x90\x25\x23\x07\x93\x9d\x84\xf9\x87\xbf\x08\x00W\xb1\x94\xea\x7c\x97\xcd\xb9\x95P w\xa7\x15\x24\xbf\xd8\x27D\xec\xc4\x819\xa1L\xfar\xbam\xbc\xba\xe8H\x2f\xcd\x8c\xd2\xd5\x5b\x15\x90\xc5K\x83\xd6\xa7\xe37\xa5\xf9\x01\x27\xdc\x83\xd2\x83\xc1\x91\xcejX\x1a\x2bW\xfa\xd8j\x40\xee\xbe\xb8\x8bc\x86\xf0\xfd\x7c9\x26\x29e\xfa\x25Z\xdfEQO\xb1\xf9\xad\xe5q1\x99\x0cm\x3c\xc0\x9d\xba\x16\xb8\x0a\x09\xd5yPo\xaa\xfb\xaa\xeaI8\xa2\xdaL\x27\x10\xe3\xf07\x86m\xf8\x988\x15\xbb\x90\xb9\xb8\xb8\xeb\xb2k\xdf\x0fiBTz\xea\xfeW\x2b\x2d\x829\x04\xd6\x5b\x7e\xe8a\x99\xb21\xed\xda\xd7\xd3 I\x11\xd7IAu\x95\x91\xe4\x26\x16\x07\xd88\x92g\xd0k\x8e\x1cV\x0a\xaf\x81\x07\xdc\x85\x07\xcd\x5e\xf0\x40\xd7\x10\xb1\x0e94\x99\xd1AN\xf8r\xa2\x19\xc8\xcf\xc6\x291\xc3NV\xc3D\xbd\xcb\xac\xcb\xdd\x837\xec\xe1\x87\xe7\xe3\x1aOT\xa1Q\xfc\xf6\xce\x27\xc3\xbdW\xf9\xe6\x01tx\xeb\xc7P\xa6\x10\xcb\x05v\x07\x09\x09RJ\x08\x26\xf7\xb8n\xb5\xef\x18\xaen\xae\x9a\xb4nO\x99\xfc\x1a\x1b\x92\xa2\x2c\x98\xa8\x60\xf0\xbb\xb8\xb6\x26Le\xad\xf0\xc6\x11\x087\x7f\xb8b0\xe4gs\xd3\x3d\xebs\x05z\x01\xb6\x89\x8b\xafkp\x5b\x19\xd7\xef\xe2K\x3b\xf0e6\xb2\xb5\x261\x5b\x10\x05i\xe4\xb2\x91\x0e\xc6\x92\xa5\xd2\xd4\x7f\x07\xa9\x9d\x16\xeaU\xadL\x8eG\x19\x1d \x7c\xa4\xa3\xa2\xf37\xbe\xd7\xe3\xc8\xb3\x85\x94\x1c6\xa0vaao\x1dc\x11wy\x16\xec\xab\x5fT\xcby\xe1\x01k\x01e\xc0ii3?\xef\xeb\xa4qO\xe1K\x82\x2a0gwR\xcf\x89\xfcf\x5d\xbfD\x96\xf0\x24\x09:\xc3\xdbI\xf1j\x3e\x83\x5c\xc7\xa1D\x1fb\xd3\x08\x3dq\x18\x1e\x1dh\xf1\x05\x11\x11mo\x10\x1f\xc0\xf4\xb52\x96\x9c\xff\x14\xb7\xb20\x10\x0e\x05\x2c!6\xa7\x16\xbb\xeb\xbf\x9f\x3cj\x84A\x3e\xdb\xdb\xd2\xe9\x1c\x2bV\x03\x96\x5c\x5e\xdc                                                                                                                         </data></write>
    <read><delim>\x0a</delim><match><data>Starting dissection...</data></match></read>
    <read><delim>\x3d\x3d\x3d\x3d\x0a</delim><match><pcre>.*New Packet</pcre></match></read>
    <read><delim>\x3d\x3d\x3d\x0a</delim><match><pcre>.*===rofl</pcre></match></read>
    <read><delim>\x3d\x3d\x3d\x0a</delim><match><pcre>.*===dyewoodsocii</pcre></match></read>
    <read><delim>\x3d\x3d\x3d\x0a</delim><match><pcre>.*===iconismanisostemonous</pcre></match></read>
    <read><delim>\x3d\x3d\x3d\x0a</delim><match><pcre>.*Dissection finished</pcre></match></read>
</replay>
</pov>
