<?xml version="1.0" standalone="no" ?>
<!DOCTYPE pov SYSTEM "/usr/share/cgc-docs/replay.dtd">
<pov>
<cbid>CROMU_00039</cbid>
<replay>
    <write><data>\x00\x93\x01\x25\x90aaaaaaaaaaaaaaaaaaaaaaaaaaaaaaaaaaaaaaaaaaaaaaaaaaaaaaaaaaaaaaaaaaaaaaaaaaaaaaaaaaaaaaaaaaaaaaaaaaaaaaaaaaaaaaaaaaaaaaaaaaaaaaaaaaaaaaaaaaaaaaaa</data></write>
    <read><length>5</length><match><data>\x00\x03\x04\x25\x01</data></match></read>
</replay>
</pov>
