<?xml version="1.0" standalone="no" ?>
<!DOCTYPE pov SYSTEM "/usr/share/cgc-docs/replay.dtd">
<pov>
<cbid>service</cbid>
<replay>
    <write><data>\x04\x04\x00\x00</data></write>
    <write><data>\x01\x00\x00\x00\x01\x00\x00\x00\xf0\x03\x00\x00\xe8\x03\x00\x00\x00\x00\x00\x00\x00\x00\x00\x00\xe8\x03\x00\x00\xdd\xda\xfd\x11\xba5XNK\x80\x27C\x98\x00\x00\x00\x60s\x0b\x11\x0a\x83\x40\xba\xd8\xfc\xd1\xea\x3cs\xcfV\xdbm\xccr\xdd\x15\x0a\xda\x3cN\xb0pF\xf7\x92\x93UW\x13EM5\xe7\xa3\xbd\xd4E\x82\xd8\xa2\xba\xebd\xc1\xef\x2f\x8daV\x3b\x3dX\x00\x5b\xb4\xcc\x2az\xfa\xe3\xdc\xc3\x22\xcd\x88\x02N\xc3\x9b\xac\x0e\x1d\xeb\x82\x87\xf1\xa2\xeaB\xb6\x86\xee\xa1\xf3\xbay\xde\xeb\x1aj\xa1\x16\xb7\x5f\x00e\xd1\xebr\xbf\xd4\xc5\x18Kn\x82\x15\x87\xd0\xa1\x11\xc6r\x9a\xde6\xb8\x7c\x5f\xf2\x3b\xf3b\x0a\xb3\x95\x2d\xab\xa1\xaf\x9e\xce\x25\x5f\x00\xd4o\xac\xf6l\x13Z\xd4\x27\xa0R\xabX\x9e\x83\x92\xda\x3bZOI\xa5Z\xb7\x7d\xcfh\x22\x13\x9c\x98Y\xcd\x93\x9a2Um\x89v\xf0\xf5\x12i!\x97\xab\xe8\x8a\xa4J\xb0S\x80b\xd8\xacB\x5f\xb8L\xb0\x17Qgs\xce\xd0E\x99\xbb\xb0\x10\x04\x9d\xdfU\x15\xac\x9e\x5b\x24\x7d\xfcrZK\xeeF\xe0\x17\xe4\xa5\xfd\x5d\x27\xac58\x60\xdc6\x3e:\xd6w\xb6\x0a\x83\xa0\x25\xa5\xf4\x7e\xef6L\x22\xfe\x1d\x28\xd4Z\xe0\xc2a\x80e\xe4:\x7f\xfeK\x7d\xc8\x2bb\xd8\x3dD\xa1\xb4\x7e\x11\xf7H\x3bi\x85\x27Q\xc1\x3d\xfc\xbf\x06\xcb\x0e\xca\x26\xb6NcB\xc9 \x12\xfb\xfc\xbe\x3c\x94\xd1\x9a\xe6\xda\x121\xc2\xd6:\xae\x9c\xed\x1ai5\xa0\x83I\x14\x1cI\x90x\xb2\x92Z\x1b\xd0\xdc\x97\xac\xd7?\xd2\xdf\x24?T\x22\x93e\x5f\xd9\xb0a\xd1\xd1\x5f\x00b\x19\xa6\x29\x1e\x25T\xe53\x5f\xa8\x05\x11\xe1\xb0\x9f:\xac\x88\x24\x3br\x2fG\xcc\xadIS\x9b\xec\xc2\x8a\x822\x40\xe0\x3b\xb89\x5fQ\xeb\xa3\x84Ld\xd8\x7d\x29\x7c\x7d\xe0\x92\x2ds \x00\x5d\xe4\xdd\x2dh\x8d\x83\xb1q\x89\xb0\xbe!?M\x0e\x0d\x12\x27Jaa\x0c\xf71\x13\xdf\xbf\x0c\xcb\x09\xbd\xa8j\x22\x94\xb4\xdd\xf99\x5f\x7c\x2f\x17\x14\x3dA\x92\xb9\xcb\x01\xb3\xff\x3e\xab1\xda\x7f\xd4H\xaf\xe3\xca\x25\x2c\x9e\xe0\xbe\xcdRT\xe7d\xd2\x16\xebX\x0f\x0d\x1c\x80\xab\x7f\x9d\xc9\x04\x93\x15\xa2\xfc\x0aW\x2d?\x957j\xf4\xe3u\xb6\xb2c\x13\xfe6\x18\xfd\x0fm\xe2\xa2\x8a\xf5\xa7\xab\xa6\xa2\x0b\xcafL\xdd\xb2\x1dH\x00O\xd6\xb5\xac\x7dz\xc2\x5f\xf0\x7b\x25M\x26\x40V\x80f\xde\xb7l\x9d\x98\xb7d\x98:\x2c\xaa\xec\xfe\xfa\x06\xd9q\xacc\x02W \x02\xe9\xa5Z\x14\xd9\xf22x\x2a\xb24\x1f\xb1J\x0f\xb2\x2dL\x93\xf1\x97G\xec\x82\xaf\xc6\x98\x87\x7fj\x2f\x98\x14\x08\xdb\x05\xe85\xcfB\xab\x15l\x10\x0aS\xd0\x19\x1d\x10\xcc\xfev\xa0\x01\x89\x01N\x08\x0a\x9e\xf1\xe6.E\xc1\xa0Wo\xc1\xe2\x92\xfc\x89\x0f\xfb\x1b\xf5\xcbG\xf4\x00n\x03\x9d\xf5\x10\x93\x95\x9dc\x82C\xed6k\xc0\x40k\xfb\x044\x0d\xce\xd7\xe5\xd2L\xb8\x3e\xff\x12\xb0\x18\x2d\xa3\x22\x83\x2c\x29\xa8\x9b\x03a\xfb\xeb\xeb\x0d!\x7b\xa2\xb1\x17\xbax\xa6\xcer\x95\xca\xbb\x83\x05\xaf\xe8\x04\xe8\x08\x19\xa0\xa1\x2fW\xce\xf3\x143\x89\xfbS\x0a!\x89\xc9\xc9\x18\x28\x05\xb0\xf5\x408\xba\xfd\x99\xde\xe0\xf8\xa0d\x5eR\xca\xd0\xe5\x99\xf4\x91B\x0ei\xb2\xee\xc0\xa3p\x86\x3cbx\x15\x1e\xbc7\x91\xd7\x08\xd9\xb1\x5f\x5b8\x0c\x08\x19\x2f\x1a?\xa3ab\xc5\xda\xa8UTh0\x5fU\xa0Y\x05\x8d\x93\xf2\x223\x94\x27\xcc\x99\xae\xc7\x83\xb2\x9d\xd1\xdf\xd0:\xc4N7Y\xe1\xc0\xf0?\xd0\xbe\xdf\x25\xb3\x04\x5f\xce\x07\xb4\xb9\xc9\xe8\x88\x253\x40\x2b\x81ig\x60\xe3\x8d\x1d\xcc\x9a\xceB\xd0\x86ugKE\x87:\xb0\x85v\x1a9\x226\xeef\xef\xd11\xc0f                                                                                        </data></write>
    <read><delim>\x0a</delim><match><data>Starting dissection...</data></match></read>
    <read><delim>\x3d\x3d\x3d\x3d\x0a</delim><match><pcre>.*New Packet</pcre></match></read>
    <read><delim>\x3d\x3d\x3d\x0a</delim><match><pcre>.*===lol</pcre></match></read>
    <read><delim>\x3d\x3d\x3d\x0a</delim><match><pcre>.*===assentaneoushemal</pcre></match></read>
    <read><delim>\x3d\x3d\x3d\x0a</delim><match><pcre>.*Dissection finished</pcre></match></read>
</replay>
</pov>
