<?xml version="1.0" standalone="no" ?>
<!DOCTYPE pov SYSTEM "/usr/share/cgc-docs/replay.dtd">
<pov>
<cbid>service</cbid>
<replay>
    <write><data>e\x01\x00\x00</data></write>
    <write><data>\x01\x00\x00\x00\x00\x00\x00\x00M\x01\x00\x00E\x01\x00\x00\x00\x00\x00\x00\x10\x01\x10\x10\x00\x00\x00\x00E\x01\x00\x00\x5ew\x86\x2d\x1bl\xbe!\x0e\xad\x7bu\xb7\xea\xe3dv\x89\xdcEW\x00\x00\x00\x01\x005:\x89\x5e\xbd\xcb\xb3I\xf7\x01\x16\x29\xdff\xd9\x2d\x86\x232vv\xa0\x01\x01\xa5A\x00RK\x05\x87b\x40s\x9e\xffW\xeaV\x9f\x129o\x91\x06\xd1\xceh\x5d\x81G\xfe6\x9616v!\x0cCCy\xd9\xef\xd9\x06\xb3\xeb\xc85\xa3\xb7\x02\x0f\xd0\xb8\xb3\x2a\xeb\x9e\xb5\x2f\x0981\xb3\xd9\xceK\xa9\x25\xd7\xb7\x04 \xb4\xe6\xabq\xd9\xc7\x822o\xb1\x08\xban MGd\xc1\x8e\x8d\x10\xa8\x9b\x8e\xe3\x0e\x02n\xf3\x85l\xbc\xbe\xce\x07\xc7S\xabJ\xc0L\xaa\xc4\xad\xc2\xea\x03ow\xe1\xfdK\x910\xf4\x97fy\x08\xdcH\xe9\xc4\xcbZh\x10\xd2\xe2\x2b\xdc\xa8\xd8\xb6\x9f\xb1R\x96\x40\x08tA\xbf\x96\xa1\x0dg\xe1N\x80\x18vt\xf5T\x10\x9b\x9f0\x99:\xd2o\xfd\xb2HZ1\xde\xc7\x07\x00\xd2\xcb\xb2\x7b\x8er4\xf8\xad\x7bq\x2b\x0d\xe5\xf2\x99\xe5\xfa\xca\x067\x5b\xfe\xb8V\xe9a\x1c\x80\xf2\x22\x0a\xf4\x29\xda\xb0\xcc\x9c\xf1T:\x80\x9c\xf1\xd0\xe1\x04\xd8\xc8\xb6\x00\xe6or\x5d\xf3\x28\xae\xe06\x0d\xe02\xa7:H\xcbq\x04\xf4p\x40\x23\x93\x91\xb7\x7b\xe3\xf4\xb4\xe2\x7f\x03\xbdA\x00x\x3dA\x00\x01\x96</data></write>
    <read><delim>\x0a</delim><match><data>Starting dissection...</data></match></read>
    <read><delim>\x3d\x3d\x3d\x3d\x0a</delim><match><pcre>.*New Packet</pcre></match></read>
    <read><delim>\x3d\x3d\x3d\x0a</delim><match><pcre>.*===llama</pcre></match></read>
    <read><delim>\x3d\x3d\x3d\x0a</delim><match><pcre>.*===llamacoruscant</pcre></match></read>
    <read><delim>\x3d\x3d\x3d\x0a</delim><match><pcre>.*Dissection finished</pcre></match></read>
</replay>
</pov>
