<?xml version="1.0" standalone="no" ?>
<!DOCTYPE pov SYSTEM "/usr/share/cgc-docs/replay.dtd">
<pov>
<cbid>service</cbid>
<replay>
    <write><data>S84\x3d\x22LFVyep4KvgZ4qbmBLmJEtw1du1wgGvfl941JObTvwHqEQL5YYY90dR68FuJia21rTqbJz4QRZ80RH5sAoM8ffEXXPLQD7DDBKrEZ\x22\x0aA94\x3d\x2d78585.593\x0aCLEAR E13\x0aO23\x3d\x3d\x28LN\x28Y41\x29 \x2b 59571.468\x29\x0aSHOW W42\x0aH61\x3d\x3dCOS\x2885496.765\x29\x0aCLEAR F53\x0aREPR Z3\x0aO96\x3d\x2d26342.878\x0aCLEAR X66\x0aREPR F K7\x0aU6\xfe\x3d\x2204QtH4A2eQ2cT4bBZTLSCluH0mmJazDXy5rUP7C0CimFtR7gVT7VA7d2NSwvFcEDfvdiMrBIAMwnr3NZrBiZiYM9GPyGN4ldJykx\x22\x0aREPR B38\x0aP7Q\x3dLN\x28\x28SQRT\x28S59\x29 \x2b 85590.734\x29\x29\x0aCLEAR R28\x0aCLEAR L65\x0aREPR R94\x0aQ40\x3d2991.271\x0aCLEAR J0\x0aSHOW K1\x28\x0aE4\x28\x3d19090.558\x0aV17\x3d\x2d78374.418\x0aREPR G13\x0aX17\x3d\x2d97874.298\x0aSHOW T39\x0aO14\x3d88859.596\x0aCLEAR Z50\x0aSHOW V55\x0aC\x3bEAR P94\x0aR75\x3d\x2d1559.905\x0aCLEAR R76\x0aCLEAR J71\x0aCLEAR S44\x0aCLEAR Q82\x0aV72\x3d\x3d\x28\x2d30440.695 \x2f MAX\x28LN\x28\x2833098.600 \x2d 43702.098\x29\x29\x2c \x2d47880.669\x29\x29\x0aSHOW H16\x0aI32\x3d65263.192\x0aSHOW Y56\x0aZ79\x3d\x22ctpvPW0j9TPnWBeYdShv7HkS7pZKJ7uhmC1WtFfAaa12ksKIm3bKLkxCjHFnT1cBxWGJCrlvhHtLoDIS6yJsFrzueYEMycUxv6o0\x22\x0aREPR E36\x0aT46\x3d\x3dSQRT\x28W26\x29MEDIAN\x0aCLEAR V1P\x0aCLEAR O86\x0aCLEAR D95\x0aREPR M32\x0aD47\x3d\x3dPOWER\x2840507.433\x2c CO9\x28\x2d73964.156\x29\x29\x0aW71\x3d\x2d64577.432\x0aSHOW B43\x0eCLEAR O44\x0aSHOW U68\x0aSHOW O14\x0aSHOW W71\x0aSHOW P7\x0a O96\x0aSHOW O23\x0aSHOW V72\x0aSHOW V17\x0aSHOW Z79\x0aSHOW 2\x254\x0aSHOW R75\x0aSHOW I32\x0aSHOW H61\x0aSHOW A94\x0aSHOW X17\x0aSHOW D47\x0aSHOW T46\x0aSHOW E47\x0aEXIT\x0a</data></write>
    <read><length>1</length></read>
    <read><length>1</length></read>
</replay>
</pov>
