<?xml version="1.0" standalone="no" ?>
<!DOCTYPE pov SYSTEM "/usr/share/cgc-docs/replay.dtd">
<pov>
<cbid>service</cbid>
<replay>
    <write><data>\x04\x04\x00\x00</data></write>
    <write><data>\x01\x00\x00\x00\x01\x00\x00\x00\xf0\x03\x00\x00\xe8\x03\x00\x00\x00\x00\x00\x00\x00\x00\x00\x00\xe8\x03\x00\x00\xdbp\xdb\xb0\xcf\x04\x3cp\x85J\xda\x92\x90\x00\x00\x00\xb8\x8b\x7c\xbc\x13\x00\xf7\xff\x1f6K\xefl\xde\x13\x00\xc6r\x9d\x1aI!\x02\xc9\x0b\xe9\x3bC\xb0\x0b\x91\xd5\x5d\xfd\xee\x0dj\xa8\x7d\xd9d\xed\x23\xe5d5A\xf7\xb7\xf1\x84\x12\x9d\xec\xd2D\xbbcF1G\x89kPW\x02\xd4G6\xe3\x13\x60\x96\x18\xcd\x06\x0c\xcbg\xe4\xac\x95\xa5\x27\xd0\xb4\xde\xe6\x3dj\x01o\xb6\xfbk\x9et\x00\xe8\xad\xc6\xcc\x18\xf2\xa1\x8e\xfbk\x87\xa0\xddI\x7e\x8aC\x15\xe5\xd0\x9aM\x8bR\x40\x9f\x93\xcf\xf0\xdf\x29\x5d\x9c\x80\x83\xce\x28t4\xe4YW\x90e\x06w\xefn\x99\xb0\xca\xcd9\x1a\xc4R6\xca\xc5\x19\xea\xb7\xfd\xd9\x3e\xb4\xf1b\xff\x9fO\xe0\xe8\x1an\xed\xb8\xaeP\xa8\xd0\xe6\x1cKu\x0f\x18m\xf86\x0a\x24\x9a8\x0b\xf9j\xf4d\xc4PG\x9f\xe2\x8f\x26\x2fZ\xf4\xfe\xc6m\xf7\x24\xc9\x81\xbc:?b\xe6\xad\xde\x9a\xf3\x80\x11\x9e\x7b\x80S\x2b:\x88\x5bKEO\x0d\xc7\x10\xb8\xc6\x9b\x9f\x27\x87\x7e\x3e\x5e\xab\xbc\x23\x01\x9c\x08\x0f\xc0\x28Hy\x92\x12W\x9aZ3\x5chI\xe5b\x07Cb\x7dF\x8c\xc9\xd8\x7euL\x1fq\xdahx!\x2d\x86\x8d\x92T\x98\x8f\xcc\x1d\x8f\x15\xde\xda\x9d\xe7M\x22\xa3\x5d\xca\xd6\xa1\x0b\x0e\x13\xbb\xc1\xba\xab\xef\xe0\xf8\xdd\xce\x1b\x82\xe9W\xb5\xef\x0f!\xadgr1\xc3\xd9\x1c\xbdw\x29\xf0\x7c\xa9r\x9c\x9e\x16\xa2\x12\xbf\x7d\x995\xb7J\xd1\xfb\xcd\xaf\x16\x07\xded\xe9\x22\xa6\x08\x9d\x60\xb2\xf8\x89d\x11\x29\xa2Z\x27\xd1\x0c\x5c\xf8\x8c\x0fp\x2d.\x7f\x5b\xa9\xf4\x7c\xcbMH3\xf0\x14\xce\xad\x96\xf5\xbe\xf5\xdd\xb8\xa2\x2aVJ\x09\xd1\xad\x07\xecB\x07\xc1a\xba\xfeA\x90\x03\x1f\x3d\xd7\x0d\xdc\x2a\xac\x8fYjkX\xaa\xf8\xa8\xf8nx\xf2\xebr\xae\xd6Vl\xdf\x10\xe2\xb9\x99g\x14\x1aa\xb4\x1fo\x07n\x5b\xcd\xb39\xd8\xe2\x04\x99\xcaZ\x22\xb0\xf6\xe8\x5d\xcdR\xafz\x00\xf9\x2b\x89\xf5\xdc\x88\xef\xc0\xad\xc9eO\xe1\xaf\x2f\x27\xd6\xf4L\x5b\x8c\xd8\x93\xc7\xe6\x9fE\xa8O\xc8!\x13\xfc\x0e\xde\xdf\xb9O\xf2I\xe8H\xb5\x19\xcc\xe8\x1bI\xd8HC\xae\x0dK\x7e\x0d\x90x\xe5\xed\xe5\xbd\x11\x5e\x95\xa0\xcc\xf1\xfa\x93\xae4\xe1\xe1A\xdb\x3e\x82\xc8\x8f\x2a\xbe\x27\xb7\xac\xd7\xbdC                                                                                                                                                                                                                                                                                                                                                                                                                              </data></write>
    <read><delim>\x0a</delim><match><data>Starting dissection...</data></match></read>
    <read><delim>\x3d\x3d\x3d\x3d\x0a</delim><match><pcre>.*New Packet</pcre></match></read>
    <read><delim>\x3d\x3d\x3d\x0a</delim><match><pcre>.*===lol</pcre></match></read>
    <read><delim>\x3d\x3d\x3d\x0a</delim><match><pcre>.*===undercropArenga</pcre></match></read>
    <read><delim>\x3d\x3d\x3d\x0a</delim><match><pcre>.*===menialitypreintelligent</pcre></match></read>
    <read><delim>\x3d\x3d\x3d\x0a</delim><match><pcre>.*Dissection finished</pcre></match></read>
</replay>
</pov>
