<?xml version="1.0" standalone="no" ?>
<!DOCTYPE pov SYSTEM "/usr/share/cgc-docs/replay.dtd">
<pov>
<cbid>service</cbid>
<replay>
    <write><data>\x83\x01\x00\x00</data></write>
    <write><data>\x01\x00\x00\x00\x00\x00\x00\x00k\x01\x00\x00c\x01\x00\x00\x00\x00\x00\x00\x10\x01\x10\x10\x00\x00\x00\x00c\x01\x00\x00\x0b\xfao\xb0\xdf\x1b\x96\xfd\x8f\xb7\xca\xael\xff\x98\xe0\x2d\xad\xc16\x60\x00\x00\x00A\x00\xed\xb4A\x00\x2fl\x26\xb0\xfd\xcc\xf8\x01\xe0\xad\xb4\x7f\x97\x01f.\xaa\xbb\x8d\x96\x1a\x9bn\x01\x97\x01\x00\xb8A\x00\x01C\xff\x82\xefzU\x8a\x9f\x60\x2a4\xe3\xe8\x87\xc7N\x2d?X\x97\x17\xcf\x93M\x1b\xf9\xf2v\xf0\xfa\xefn\x0a\x08\xf1\x83\x94!1\xc7\xf8\xed\xca\xa1gp\xd2t\xcc\x15\xfa\x8f\xa8\x3eV.\xc93\xf6\x23\x27\xf2\xf8r\xb7\xbeU\x01\xbd\x83o\xe9k\x92\xec\xf0?z\x2bj\xf1\xa1ca\x00\xe7\x2f\x85\x1f\xf5\x83BE8\xb63K\x27\x97X\xe24\xff\x5dB\xb3g\xbaL\x9a\x9b\xad8\xc0\x92\x86\x84K\xe3\xd5\x9bS\xdf\xef\x3e!\x7c\xedBpo\x9aZhq\xf8\x3d\x98\x80\xe1\xe0\xf2\x1e\x01\xaa\x81\xc4I\xf2\xf0t\xebz\x04.\xa1?\xf9\x96W\xd4H6\xef\xe2zq\xa3z\xb8\xf6M\xc3exf?\x2f\xe07\x28tt\x25\x2a\x28\x0er\xa5q9\xb1\xb2\x18\xfc\x3b\xec\x96\x8e\x9aC\xa8cM\xf1\x11m.\x27\x8a\xa1\x17\xa9\x9fu\xced\x89\xc1.\xbco\xf4\xd0\xb7\x81\x9e\x22\xc5T\x13\xb3\xed\xd9\x23\x60\xa1\xc6\xc9\xf7\x13\xba\x0e\x02\x1b\x04\x5d\xeb\x8c\x10\xb3fP\x04\x18\x9b\x28\x01\x00\xa0\x01\x00d\x01\x00\xb1\x01\xa1\x01\x00\xdd\xa4 \xbc\x1c\x3eS\x10\x23\xae\x87\xb4\x9d\x01\x19\x01\x00 \x01\xc4A\x00A\x00</data></write>
    <read><delim>\x0a</delim><match><data>Starting dissection...</data></match></read>
    <read><delim>\x3d\x3d\x3d\x3d\x0a</delim><match><pcre>.*New Packet</pcre></match></read>
    <read><delim>\x3d\x3d\x3d\x0a</delim><match><pcre>.*===llama</pcre></match></read>
    <read><delim>\x3d\x3d\x3d\x0a</delim><match><pcre>.*===llamaantimaterialistic</pcre></match></read>
    <read><delim>\x3d\x3d\x3d\x0a</delim><match><pcre>.*Dissection finished</pcre></match></read>
</replay>
</pov>
