<?xml version="1.0" standalone="no" ?>
<!DOCTYPE pov SYSTEM "/usr/share/cgc-docs/replay.dtd">
<pov>
<cbid>service</cbid>
<replay>
    <write><data>\x04\x04\x00\x00</data></write>
    <write><data>\x01\x00\x00\x00\x00\x00\x00\x00\xf0\x03\x00\x00\xe8\x03\x00\x00\x00\x00\x00\x00\x00\x00\x00\x00\xe8\x03\x00\x00\xa7l5\xa4\x8f\xfc\xfd\x3bj\xe9\xf8\x9b\x2d\x5b\xec\x95\x08\xff\xfa\x2f\x1a\x00\x00\x00\xcfh\xad\xc3\xf4O\xd4A\x7c\x02\xc9MA\xf3\x9c\xe5\x1e:\x90\xcf\x2d\xfd\xd4\xcb5\x85\xc8\xc5.\xf02\xf5\x3cF\xfc\xf0\x5c\x5c\x14 G\xc8\x0f\xe4H3\x1d\x15ey\x07\x3cc\x82\x01H\xc8\x08\xe9\x91\x1f2\xe4\xbb\x1c\xb0\x02\x85\x8eS\xb8.\x1b\x244\xbe?\xfbL\x00nKo\x8f\x18F\x9b\xe4r7\x0e\xe4\xcc\x10\x88\xc3\xb4PX\x06\x7c\x5d\xe6\xa2\xef\xb2M\xb9\xcf\xfb\xc3\x97\xa5\xcd\x7e\x03\xde\xa7\x96\xc2m\xef\xd6Z\x08\x17\xb7\xd5Y\x2c\x8d\x0a\xc1\x00?\xbc\xf4\xb7?\xb4T\xdd\x17m\x9e\xdb\xc0\xa4\x80\xaf\xc1\x87\xbda\xe8\x86\x2f\x5b\x18\xbdF\xa5\xaf\x10\xb6\xc8\xdc\xef\x08Om\xabL\xd1\x22\x7f\x06\xfa\x83\xc2Q\xcf\x29\x1d\xaa\x8e3r\x27\xc7\xb7T\x91\xe7F\xe2K\xd9\xbd\xaf\xacS\x04w\x01\x8a\xc5\xeeg \x00\xa16U:Y\xbd\xbbN \x00 \x00\x0d\x90\xb85F\xe6fd\xb4E\xcd\xbbV\xaaD\xf8\x08\x10\xa2\xd0\x88\x04i\xa6\x0f\xac\x7b\xef\x8eQ\xbbk\x956\x27\x19p\x8a\x5c\x3ew\x93\x80G\xbc\xa6\xf0S\x0b\xf1vq\xec\x9d\x93\xacD\xeb3\x8bi6\x0c1b\xe6W\xb5\x18\x1d\xf9\x16vL\x5e\xe8\x92\x0c\xec\xf0\x3d\xfc\xb8W\xa1\xb7\xfa\xaa\xf7\xa91\xee\xa2\x1f\x04\xc2\x1bM\x22\xe0\xba\x8e\xbe\xe2\xbdJ\xed\x8a\x02\xf6PB\x94\x8b\xde\xc1\x8d\x97\xe5\x00\x2fRC\xc7\x8d\x90j\x856\x8e\x60\x3d\x09\x97 \x0f\x7d\x0d\x14\x26\x84\xdd\xb1 v\xbf\x09\x2a\x3d\xd8KZ\x14\xe5\x81\x25\x07i\x0a\x89X\xcb\x0d\xf6\xb5k\x8d\x85\xe0\x40\xc8\x00D\xb5\x1c\xaa\xdc\xa8a\x10w\x8d\xf0\xa0\x5fb\xf4\xfc\xe6\xd9\x0e\xd5dl\xa3u\x9d2\xb6\xc2\xca\xc6\x8f\xc7\xa9                                                                                                                                                                                                                                                                                                                                                                                                                                                                                                                                                                    </data></write>
    <read><delim>\x0a</delim><match><data>Starting dissection...</data></match></read>
    <read><delim>\x3d\x3d\x3d\x3d\x0a</delim><match><pcre>.*New Packet</pcre></match></read>
    <read><delim>\x3d\x3d\x3d\x0a</delim><match><pcre>.*===rofl</pcre></match></read>
    <read><delim>\x3d\x3d\x3d\x0a</delim><match><pcre>.*===receptivenesssempervirent</pcre></match></read>
    <read><delim>\x3d\x3d\x3d\x0a</delim><match><pcre>.*Dissection finished</pcre></match></read>
</replay>
</pov>
