<?xml version="1.0" standalone="no" ?>
<!DOCTYPE pov SYSTEM "/usr/share/cgc-docs/replay.dtd">
<pov>
<cbid>service</cbid>
<replay>
<write><data>new\x0a</data></write>
<write><data>sd 1\x0a</data></write>
<write><data>q2q4\x0a</data></write>
<read><delim>\x0a</delim><match><data>move p7p5\x0a</data></match></read>
<write><data>p1r3\x0a</data></write>
<read><delim>\x0a</delim><match><data>move s8r6\x0a</data></match></read>
<write><data>n1o3\x0a</data></write>
<read><delim>\x0a</delim><match><data>move p5q4\x0a</data></match></read>
<write><data>o3q4\x0a</data></write>
<read><delim>\x0a</delim><match><data>move p8p4\x0a</data></match></read>
<write><data>r1n5\x0a</data></write>
<read><delim>\x0a</delim><match><data>move o7o6\x0a</data></match></read>
<write><data>n5p3\x0a</data></write>
<read><delim>\x0a</delim><match><data>move o8s4\x0a</data></match></read>
<write><data>r3r4\x0a</data></write>
<read><delim>\x0a</delim><match><data>move r6q4\x0a</data></match></read>
<write><data>r4q4\x0a</data></write>
<read><delim>\x0a</delim><match><data>move q7q5\x0a</data></match></read>
<write><data>s1r3\x0a</data></write>
<read><delim>\x0a</delim><match><data>move p4q4\x0a</data></match></read>
<write><data>p3q4\x0a</data></write>
<read><delim>\x0a</delim><match><data>move s4r3\x0a</data></match></read>
<write><data>s2r3\x0a</data></write>
<read><delim>\x0a</delim><match><data>move r8n4\x0a</data></match></read>
<write><data>o2o3\x0a</data></write>
<read><delim>\x0a</delim><match><data>move n4p6\x0a</data></match></read>
<write><data>p2p4\x0a</data></write>
<read><delim>\x0a</delim><match><data>move q5p4\x0a</data></match></read>
<write><data>o3p4\x0a</data></write>
<read><delim>\x0a</delim><match><data>move t7t5\x0a</data></match></read>
<write><data>o1s5\x0a</data></write>
<read><delim>\x0a</delim><match><data>move n7n5\x0a</data></match></read>
<write><data>t2t4\x0a</data></write>
<read><delim>\x0a</delim><match><data>move r7r6\x0a</data></match></read>
<write><data>s5p2\x0a</data></write>
<read><delim>\x0a</delim><match><data>move q8r7\x0a</data></match></read>
<write><data>m2m4\x0a</data></write>
<read><delim>\x0a</delim><match><data>move n5n4\x0a</data></match></read>
<write><data>m1o1\x0a</data></write>
<read><delim>\x0a</delim><match><data>move t8q8\x0a</data></match></read>
<write><data>q1r1\x0a</data></write>
<read><delim>\x0a</delim><match><data>move q8o8\x0a</data></match></read>
<write><data>p4p5\x0a</data></write>
<read><delim>\x0a</delim><match><data>move p6q5\x0a</data></match></read>
<write><data>p5o6\x0a</data></write>
<read><delim>\x0a</delim><match><data>move q5n2\x0a</data></match></read>
<write><data>o1o5\x0a</data></write>
<read><delim>\x0a</delim><match><data>move n4n3\x0a</data></match></read>
<write><data>o6o7\x0a</data></write>
<read><delim>\x0a</delim><match><data>move n8m6\x0a</data></match></read>
<write><data>o5m5\x0a</data></write>
<read><delim>\x0a</delim><match><data>move m6o7\x0a</data></match></read>
<write><data>q4m8\x0a</data></write>
<read><delim>\x0a</delim><match><data>move o8m8\x0a</data></match></read>
<write><data>m5t5\x0a</data></write>
<read><delim>\x0a</delim><match><data>move n2q5\x0a</data></match></read>
<write><data>r1q2\x0a</data></write>
<read><delim>\x0a</delim><match><data>move r7s6\x0a</data></match></read>
<write><data>t5q5\x0a</data></write>
<read><delim>\x0a</delim><match><data>move r6q5\x0a</data></match></read>
<write><data>t1o1\x0a</data></write>
<write><data>quit\x0a</data></write>
<read><delim>y</delim></read>
<read><delim>\x0a</delim><match><data>e\x0a</data></match></read>
</replay>
</pov>
