<?xml version="1.0" standalone="no" ?>
<!DOCTYPE pov SYSTEM "/usr/share/cgc-docs/replay.dtd">
<pov>
<cbid>service</cbid>
<replay>
    <write><data>\x04\x04\x00\x00</data></write>
    <write><data>\x01\x00\x00\x00\x01\x00\x00\x00\xf0\x03\x00\x00\xe8\x03\x00\x00\x00\x00\x00\x00\x00\x00\x00\x00\xe8\x03\x00\x00\x3du\x8b\x94e\xbb\x8c0jQ\x85\xba\x8e\x00\x00\x00p\x14\xfc\xdb\xd6\xa8p\x10\xbf\x09\xd9\x1e\xac\x0e\xea\x0d\x1dq\x5b\x60\x85\xf3\xdaS\xbf\xb6CG\x60\x60\x0d\xec\xe5\x24Q\x22\xcc\x1di\xcfy\xea\x92\x1dC\x1fs\xc2\x2bZ\x3e\x0a\xd2V\xc9\x07\xf3\xdd\x038\x9ci\xae\x079\x2b\xa1\xdbq.e\xa9EsNL\xd1\x10\x0e\xc1\x84\x40\x06a\x80f\xe1\xf1\x96\x27\x92\x9aq\x9a\x27\xa8\xd0M\xa4\xcb\x9b2\x29\xfa0Tx\xc6z\xcc\x02\x80?QG\x12\x19\xff\x3d\x9c\x00x\x83c\x87\xf6\xec\x40\xee\xbd\x97\xf6u\xfc\xaa\x99\xf6\xf1\xc4\xf1y\xb2\x5f\xe32\xc00d\x5df3f\xc2\x08\xfc\xf1j\xf6\x81\x90\x16r\xc1\xc3p\x06L\xa0Q\x19\xfc0\x06\x03\xed\xc9\x5cDZ..\x9e\x9dJ\xa6\x93\x04\x05\x80K\x15RIuV\xc5\xdb\x02\xe5\x23\x9b\x2f\xde\x09\xcb\xc1\x7d\xe8\xd5\xef\xb6\xf4\x04\x94S\xe3q\xc0\x95\x0e\xe8:tl\xc5h\x5e\x18\xdf\xa2\xdd\xe4n\x5fa\xf3\x96\xad8\xc3U\xda\xdf\x8bF\xee\x9b\xc0\xdbO\xb9\x9f\x18H\x3c\x84\xac:\xcb\xf2\x18\x94\x17e\x24\xb2\xcfU\xeajo\xc7\xdf\x16QC\x5djL\x94\xda\xb3\x7dh\x80\xad\x29\xab\xf9\x18\xa6\xef\xb1x\xcfg\xbc\xd2\x0c5\xe0\xb7\xd9\xf7\x00v\xda\x26\x0d\xaa\xb5\xdf\xda\xf8\x00\x928\x60\x60\x93o\xa1H\x5e2g \x03q\x09\xc9\x22\x98\xb1\xe7Fl\x9d\xf8\x92\x28\xfeE\xb6\x26O\x60\xf28\xbak\xc8\x1c\xac\x17l\xec\xc7\x7c\x60\x00\x11\xfb\x2bW\xdf\x90\x9e\xab\x94\xa0\x1a\xac\xc0\xba!\x7d\xae\xe6C\x18S\xf9\xa2z\xea\x3b\x13n\x60\x60\x00\xe5\x8e\xebt\xa2Av\x2a\xea\xc9\xcfm\x9eo\x84!\x81\x97\x85i\xce\x3bv\x82\x0c\xf1\xffCf\xc4t\x02\xf4.K\xfb92\xbd\xa6\x1e\x3b\xe5\x0eW\xee\x02\x8bAqm\xd2o\xf7\x0f\xae\x27\xd2H\x9a\xc5\x13\xc9L\xfc\x0a6\xd2\x15\x1dg\x05\xa9B\xc0\x10h\x2f7\xf0\xfeg\x19\xfa\x83\xa5\x94\x87\xfa\xf1\x9be\xf1as\x05\x2cqHs\xfcv\xf1\xf6cm\xc34\xb0\xf8\xc3\x8d\xd3h\x12s\xa6\x92:\xefP\xb8\x9f\xde0\xeb\x5f\x24\xdd\x08AV\xe9\xbc\x25\xef\xf8\x1a8x\x94\xdb\xccn\x10\x09\xc9\x13\x5c\x8d4\xeb\x5f\xc5\x839\xea\xc5\xe31\xe2\xe7\xb6\xb0\x13Q\xe6\xed\xf6\x97\x80\x60\x00                                                                                                                                                                                                                                                                                                                                                                                                                                   </data></write>
    <read><delim>\x0a</delim><match><data>Starting dissection...</data></match></read>
    <read><delim>\x3d\x3d\x3d\x3d\x0a</delim><match><pcre>.*New Packet</pcre></match></read>
    <read><delim>\x3d\x3d\x3d\x0a</delim><match><pcre>.*===lol</pcre></match></read>
    <read><delim>\x3d\x3d\x3d\x0a</delim><match><pcre>.*===prelanguagecloudage</pcre></match></read>
    <read><delim>\x3d\x3d\x3d\x0a</delim><match><pcre>.*Dissection finished</pcre></match></read>
</replay>
</pov>
