<?xml version="1.0" standalone="no" ?>
<!DOCTYPE pov SYSTEM "/usr/share/cgc-docs/replay.dtd">
<pov>
<cbid>service</cbid>
<replay>
    <write><data>r\x0aZ\x0aR\x0aR\x0aSRPR\x05\x0aR\x0aV\x0aS\xf4\xe4\x0aR\x8a\x0al\x0aZ\x0aR\x0aV\x0aS\xe3k\x0aR\x0a8\x0a\x19\x0aS\xf4d\x0aZDR\x0aV\x0aS\xf4k\x0aZ\x0a8\x0a</data></write>
    <read><length>1</length></read>
    <read><length>1</length></read>
</replay>
</pov>
