<?xml version="1.0" standalone="no" ?>
<!DOCTYPE pov SYSTEM "/usr/share/cgc-docs/replay.dtd">
<pov>
<cbid>service</cbid>
<replay>
    <write><data format="hex">120000000000000048454c4f6701c800000058cedd263c000000000000004b45595800100000004e494345204b4559204953204e494345444154414443424106000000594f594f594f4b4559580000000000d7d657231a00000000000000444154410100000006000000594f594f594f19a37ce204000000010000000400000002000000</data></write>
    <read><length>82</length><match><data format="hex">5155455545440a5155455545440a5155455545440a48454c4f205b56455253494f4e203130335d205b534543555245206f6e5d205b54544c203230305d0a4e4f204b45590a50524f4345535320444f4e450a</data></match></read>
</replay>
</pov>
