<?xml version="1.0" standalone="no" ?>
<!DOCTYPE pov SYSTEM "/usr/share/cgc-docs/replay.dtd">
<pov>
<cbid>service</cbid>
<replay>
    <write><data>\x04\x04\x00\x00</data></write>
    <write><data>\x01\x00\x00\x00\x00\x00\x00\x00\xf0\x03\x00\x00\xe8\x03\x00\x00\x00\x00\x00\x00\x00\x00\x00\x00\xe8\x03\x00\x00\x1b\xe1\xed\xb8!R1\x29p\x3e\xf7\xfb\x8a\xf9m\xf4\xb0\xf3tZ\x08\x01\x00\x00\x26\xda\xd8\xffO\xe9\x86!\xb4i\xae\x24\xc3b\x03\xd2\x1d\x60\x29m\x0d\x29\x99\xe5\x81\x2f\xb1\x93\xb8\x8eE\xbbS\x8af\x8e\xc3t\x00\x05\x8dqr\xd59\xb1\xa3n\xef6\xe0\xd0\x7f\x172\x0e\xe2nz\x82\xb5\xc6\xf5kq\x90c\xcfG\xca\xf7J\x0d\xf2\xf5i \x05Z\x09\xe1\x86\x2c\xcbe\x2d\xd4\xfa\x2f\x7e\x1f\xa5\x0f\x92\xb8\xd3blD\xf3\x00\x0d\xd6\x95\xf0b7\xd1\xd1R\xee\x7b\xf8\xc8\x19\x97z\x2d\xb8\xb9QmB\x22\x07\xc4Y\xaa\xb6\x0c\x1a\xf5N\x94\xca\x8e\xa0\xe2\x28\x88\x5e\xa7\xcdIR\xd4\xdd\x1cn3\xc8\x40\x94Da\xb4\x7d\x2dZ\xa2\x0a\x017\xb2\x1f\xba\xd1\xa8\x86s\x8d\xfc\xd9h3\x1cI\xbf\x03o\x5b5\x91S9\x2d\x3e\xff\xbc\xbe\xb9cm\x86\xc0\xc6\xf8\x8fO\xbbN\x0eX\xb4\x7c\x03\xca\xabj\x40\x95\x25p\xb0\x96\x05\x2c\x1aXG\x29\x168\xed\x80\xdc\x23s\x2akJsOjM\x27T\x8b\x40\xc0\x0f\xc8\x1b\xf6\x9b\x7d\xc9\x26\xd1\xab\x95H\xba\xb6\x01\xb5\xe3\xe4\x9ajC\xb7T5\x2c\xc8\xa6\x8e\x9bC\xba\xb2\xb8\x92D\xd1.\x90\x5b\x5f\xd3\x27\x00\x85\x84\xf0\xb8\x85\xc6 \x0d\x04\xf6\x5f0\xfd\x04\xec\x17\xaaq\xad\xd0\x0bL\xbd3f\xf7\xab\xa5x0\xd6\x24\x5bv\xe3\xc4\x07\x04\xfe\x03p\xeaV\x26V\x85d\x24Nb\xea\xf6\xd9\xd4\x8fK\x84x\xe2Z\xc5\x8ef\x16\x00\xfdc\x83BS\xc3\x27\x19\x2c\x3d?a\xec9\x2faA\x8c\xd4\xef\x5f\xc6k7\xb5\xd0\x08\x80\xc4\xe3ZF\x5dX\x1f\xf4\xad\xad\xferv\xd8\x26\xe03C\xfb\xc0\x5f\xc8\xd0\x92\x19\xcd\x9a\xb2\xd7M\x5bS\x8f\x24\x94\x95\x09\x5c\x25X\x2f\x8d\xe3\xeb\xc2vz\x09\x26\xe1\xb0k\xc6\x1aj\x8b\xe42\xc0\x5c\x7d\xb2S\xa8h 7\xfa\x87\x96\xfb\xe2d\xf2\x5f\x96W\xdc\x0dh2\xdbj\xe76Xv4\x19\xb8\x3d\x23\xeaN\x98\x7dK\xff\x1e\xf3\x011\x5bd\xe9\xa0\x5e\xce\x94b\x1e\xc6\xc8\x9a\xff\x27\xe3\x81\xa6\x24s\x5c\xea\xd3RaFm4\x94\xc5m\xc1\xe4\x7cx\xf9\xf0\xe5\xb77bx\x1d8i\x1dN\x2c\x7dn\x91\xdb\x3e\xae\xe4\x7c\xee\xcc\xb5\x87\x9a\xa8I\xf3\x06\xf9\x92\x08\x9bmOhj\x00\xa1E\xfa\x1f\xc8\xa7\xf1C\xf0\x60\x8d\x07\x07\xd8\xbf\xc3\x97\xf5\xc8\xf7XF\x2d\x89Ak\x0a\x9e\xa0\x18\xed\x05\xe6\xb6rber                                                                                                                                                                                                                                                                                                                                                                                                   </data></write>
    <read><delim>\x0a</delim><match><data>Starting dissection...</data></match></read>
    <read><delim>\x3d\x3d\x3d\x3d\x0a</delim><match><pcre>.*New Packet</pcre></match></read>
    <read><delim>\x3d\x3d\x3d\x0a</delim><match><pcre>.*===rofl</pcre></match></read>
    <read><delim>\x3d\x3d\x3d\x0a</delim><match><pcre>.*===nontechnicalrongeur</pcre></match></read>
    <read><delim>\x3d\x3d\x3d\x0a</delim><match><pcre>.*Dissection finished</pcre></match></read>
</replay>
</pov>
