<?xml version="1.0" standalone="no" ?>
<!DOCTYPE pov SYSTEM "/usr/share/cgc-docs/replay.dtd">
<pov>
<cbid>service</cbid>
<replay>
    <write><data>\x04\x04\x00\x00</data></write>
    <write><data>\x01\x00\x00\x00\x01\x00\x00\x00\xf0\x03\x00\x00\xe8\x03\x00\x00\x00\x00\x00\x00\x00\x00\x00\x00\xe8\x03\x00\x00\xd7\xdb\x3d\xe8\x92\xf4\xd9d\xb5P\xf5\xef\xe1\x00\x00\x00\x3e!\xf7\x0c\x0e\xa6u\xc0\x9f\xb4\xc0Y\xd6M\x07\x17Pd\xbf\xd8\x7e\x60c\xb5\xe4\xd6Tw\x105F\x00\xcd\x9a\xd4\x82\x3b\xad\x17O\xaf\x19x\xc0B\xb5\x7fK\x16\x90\xabv\xd8\xf6\x3d\xe0u\x3cg\xddD\xad\xca\xf8\x97\xee\x88\xa1\x2a\xa6\xce3\x94\xa93c\x7c\xe6\x14\xb6\x5fa\xcdm\x5dY\xae\xa8D\xec\x3c\xe3\x12\xf2\xd6\x7d\x3dM\xf2\xc2\x24:\xeaTls\xaf\xc1\xd7Q\x29\xd9\xb4\x99\xda\x98jW\x5b8\x8eB\x12x\x93\xbc\x19T\x88\x0b3\x7f\xf5m\xb3\xc7\xd8\xca\x97\x86\xde\x0d\x0a\xfd\x18\xe2\xd2fE\xd8W3\xac\xe8\xca\xc9\xf16\xab\xb8 y\x2bJ\x9d\x5b\xee\x3b\x90\x9aO\x3b\xc1\xaf\x00\x8e\xf2\x8cb\x1d\x40\xf64\xbf\x2a\xfb\x5c\xb7.\x8a\xc3\x84\xef\x9f\x1cC\xe8c\xda\x9dFf\x84kA\x9e\xcb\x2d.\x14g\x2fr\xee\xbe\xbbw\xad\x2dP\x84\xe0\xb7\x2c\xa9\x16\x7b\xbf\x13\x8f\xfe\xb3\x3b\x7d\xec\xb7\xee\x1a\xe6\x29L\xe3\xc0\xbc\x9b\x0ay\xbbN\x3e\xb4\x0e\xaa\x26\xc2\x8c\x2d\x7en\xd1\x1b\xa9\x11\x5e\x8b\x26\x9f\xc2\x1d\x1f\x9dn\x0f\x11\x00\xc5\x06uUXR\x976\xb5k\x82\x00\xf5\xe8\xcb\x10\x17\x00\x17\x18t\xfa\xdf\x96\x2fh\x98\xa8\x87\x03\x07p\x90\x13\x81\x0f\x0d\xfb\x9b\x17\xe6LY\x95IIG\x5c\x96\x96\xda\xf0oXL\x0dF\x80j\xf3\xe5\xc68c\x5f\x03 \x0a\xb5n\xb3\x3ei\x18\x8f\xa7\xdeox\xae\xa6o\x7b\xd1\xdf\x8bNn\x92\xd6\x8ag5\x09\x92\x8d\x9b\x9c\xb9\x9c\x1a\x969\xcb\x0d\x842\x3dp\xb6\x22:K\xb6\xcf6YO\x7c\xd8\x91\xccAw\xfd\x3d\x912\xd2\xd2\xbb\xb6l\x3c\x8c\xbbr\xa4\x81\xe6Ne\x02\x96I\xc0\xb2\xc1\xb8\xbe\xd1\x86\x5d\x22\x29Q\x01\xf6l\xa6\xc2\xf7\x08\x89\x09z\x26\x17\xad\x3e\x7f\x12\xef\xfb\xe4r\x23\xf2\xf6\xa0\x7c\x03\xf3d\xbd\xed\x28\x05\x08i\xad\x1a\x88f\xe4\x23\x17\xcb\xca\x8c\x03\xf6t\xae\xb2\xc9c\xfb\x94\x27\xf8\xba\xab5Y\x16\xbb\x1e\xe0\xafo\x22\xab\x1aLC\x9c\xa4l\x175qq\xef\xa8\x2c\xf3i\x86\xa3S\xac\xd6\x5f\xb6\xebuH?\x25\xfee\xb4W\xac\x03\xa4\x03\x0f\xf8\xa6\xd2\xff\x1cx\xa02\xb1\xd8\xa5\xa1\xc0\xb1u\x7c\x85\x01\x88\x13\x9a\xb8\x1e\xf29\x1f\x26R\x11o\xc1t\xe2\xc0a\x1e\xba\x93\xbe\x22\xcfO\x5f!\xe3\x7ct\xa5\xd1.\x10\x8d\xdd\xff\xb4\x23C\xd3\x1e\x8c\xa2\x07\x3d\x89\x7d\xc9\x2a\xe6n\xe5\x18\x07\xe9\xcd\x92W\x87\x02\xab\x86H\xe0\xbe\x1c\x94N\xbd\xf4M\x94\xbd\xa3:\xbfnD\x11\xb2\xdfY\xb9\x1d9\xc4l\xeaO\xa2\x9b\x5d\x90a\xb0u\x5f\xcd\xf0\x2a\xfe\xe3f\xcc\x3c\x815\x1f\x85\xdc6\xe8!\xba\x92\xc2\x80\xf2\xef\xfb\x81\x17\xbc\x7c\x0c.\x2c\x7d.9\x08\x9a\x81\x8b\x10\xe3k\x3b\x28\x81\x92\xb6\x3bT\x24\x16\x60\xb5\x5c\x0e\xe4\x8b\x1f\xd4\xea\xa1\x05\xe0\x17\x17\x00M\xbb\xf3\xe3\xee\x2c\x93\x83TJ\xcd\xe4\x17\x17\x00\x80\x90\xe9\xc7K2L\x11\xfc\xe4\xd4\x96\xf9 zRZC\xb7\x5c\xeeq\xfd.\xe1r\xf2\xa4\x1aZm\x1b\x8c\xee\x90\xb7\xach\x07\xa1\xfb\xe9\x08\xd2\xbaz\x18\xf1B\xd6\x7e\x26\x9e\x03e\xfeZ\x1f\x84\x16\xe1\xeeW\x11\x04\x838\x12\x5c\xf7f\x2d\xb1\xdb\x2f\xdbDv\xec\xa5\x19L\xb2T\x26.\x805\x2co2\xde!\xef\x89\xecz\xdc\x7dC\x95\x7c\xf0\x5cT\xe1l\xe2\x93a\x03\xb6\xa2\x27h\xcc\xael\x7e\xdf\x9fi\x5e\xb7EM\x82r\x22u\x08\x0c\xed\x92\xea\xf0S\xe2Q\x7f\x2b2\x27M\xb2!\x80\xcb3R\x3d\x03M\xaa\xb7x\x01d\x2bw\x7c\x22F\xbf                                                                                            </data></write>
    <read><delim>\x0a</delim><match><data>Starting dissection...</data></match></read>
    <read><delim>\x3d\x3d\x3d\x3d\x0a</delim><match><pcre>.*New Packet</pcre></match></read>
    <read><delim>\x3d\x3d\x3d\x0a</delim><match><pcre>.*===lol</pcre></match></read>
    <read><delim>\x3d\x3d\x3d\x0a</delim><match><pcre>.*===Zantedeschiacladocarpous</pcre></match></read>
    <read><delim>\x3d\x3d\x3d\x0a</delim><match><pcre>.*===loungyimpolite</pcre></match></read>
    <read><delim>\x3d\x3d\x3d\x0a</delim><match><pcre>.*Dissection finished</pcre></match></read>
</replay>
</pov>
