<?xml version="1.0" standalone="no" ?>
<!DOCTYPE pov SYSTEM "/usr/share/cgc-docs/replay.dtd">
<pov>
<cbid>service</cbid>
<replay>
    <write><data>\x04\x04\x00\x00</data></write>
    <write><data>\x01\x00\x00\x00\x01\x00\x00\x00\xf0\x03\x00\x00\xe8\x03\x00\x00\x00\x00\x00\x00\x00\x00\x00\x00\xe8\x03\x00\x00\x16\xd7\x5b\x5dH\x00\xea\xf9\xb7\x25\x8f\xa4\xab\x01\x00\x00\x88\x2a\x9a\xa1\x40\x00a8\xe7g\x40\x00\x40\x40\x00n\x80\x3b\xfa\xcb\x97\xea\xe6a\xb9r\x93\xbe\x7d\x22\xba\x40E\x01\xef\xbd\x3c\xa6\x90\x1d\xa8\x8a\x7eUk\xddUI\x5czF\xeaW\x80\x28I\xa2\xfb5\xc3\x03\xd9V\x9f\x88\xa1\xe8\x02\x7b\xdca\xbe\xca\xf5\x8b\x92GEN\x298\x9a\x02A\xe0\x28\xf7\xfc\x98\x85\xf8\xd6\x22\xae\x22\xb5\xce\x1dl\xa8\x1f\xf6G\xf9\xff\x8e\xec\x14\x9a\x29\xa1N\x3b\xf2\xb6v\xf8\x0c\xe8QP\x85j\x60\x24\xc5\x3d\x8c\x23\xc8\xb6\xd4t\x09G\x1d\xf6F\x0b\x29\xf4\x97A54\xbd\xb72\x1d\xcb4\x08\xbc\x1f\xb9\x1c\xfe\xf8XK\x88\x3e\x2f\x8eI\x80\xf5\x7bp\xecC\xa2\x80\x25E\xe2\x0a\x17\xef\x10\x87\x94\xd7\xa12\xfd\x2f\xbf\xd7\xb2ph\xf0\xe3\xa9\x9cN\x0d\x06lc\xea\x94a\xc1B\x94\xcai\xdd\x10o\x5d\x0cw\x15\x1ba\x99q\x97\xd8\xff\xfa\xde\xb8\x8b\x98\x01\x8c\xdbq\xfc8\xac\xf253\x1e\x80\x60O\x27\x8f\x10\x2b1\xde\xc1\x3b\xa3\x2a\x5d\x87C\xff\x08wEk\xf1\x09\xe8IQx\x06\xb5vs\x7c\x11\x29\x40\xc0\xbb\x0b\xab\x01\x0a\xff\x04U\xc1\xfa\x84H\x1bS\xf5\xee\xcd\x121\x27b\xd31N\x19\x87spj\x0f\xda\x24\xbe\x1a\x60\xfc\x91Y\xc9Ib\x8a\xe6\xd4Mz\xdewS\x0bv\xd0\xb3aNHun\x18\x5c\x2b\x11\x28\x02\x40\x00\x40\x40\x00\x7e\xd3\xee\x8f1\xe7\xee\xf1\xb8!\xca\x9b\x7d\xa5\xd1\xc4O\x07\xabk\xeb\xe3\x8e\xa0\x19:ytD\x1d\x94\xc1\x95\x2ca \xa6H\x5cNI\xa2s\x92\x92\xbc:\xca\x94\x91\x9bw\x85\x28\x8c\xe9\x87\xf9\x08\x89\xc9\xf6\x7dw\x2f\xe1\x24\xd9\xaa\x15Z\x9b\xb9\x96X\xc2\xa0\x17\x05y!O\xed\xb1\x10\x40H\xec\x80\x11\x0f\xe6\xcc\x8d\xd0X\xe3\x92\x19\xc3\x3dc\xd5\xf9m\xb5a\xef\x27\xf2\xb6\xee\x93p\x7fG\x8c\xbb\xe8\xba\x9a\xc22\xaelBN\x25\x0aW\x2aJ\xa5\xc9o \xa8n\xd8\x0e\x7d\xc0T\x071\x27\xeb\x27g\xf4c\xd4\x9c\x2f\xc9\x185\x5bA \xd2\x2c8\xa85\xa1\x93Q\xac5:\x84\x98S\x01\x15\xc3\x9b\x90\xe5\xe4\xd0YW6W\xbf\x18:\xc6\xe3\xbb\xd4\x83\xaaA\xf6\xb4i\x5e\x0f\x9d\xaeS\xbc\xd1\xae\x12\x0b\x14\xb5\x852a\x84\xb2\x7d\xd3\x2c\x86it\x24\xbc\x40\x00\xfe\x90\x5d\xb2\x27\x8a\xd3\xca\xc4\xf0\xd5w\x40iR\xd9\xb1R\xaap\x89r\xae\xf1\x5eV\xfb\xe6q\xc9\x3b\x0d\x89\xdd\x17\x5f.p\xc3i\x98\x96\xc7\x7czo\xa2DZc\xd6\x99\x0bk\xe2\xa7!\xfc\x3cf\x9e\x83\x98\xc2\xa7\xeb\xe3W\xf9\xe9\xe2\x5c\xca\xf4\x1a\xdd\x1e\xcf\xd2\x98\xd3\xbf\x5dGjPy\x29z\x89\x89v\xac\xb2\x90lz\x00\xa8\xc4\xa13\x0ay\x16\x05\xd2\x84\x9c\x5e\xe2g                                                                                                                                                                                                                                                                                                              </data></write>
    <read><delim>\x0a</delim><match><data>Starting dissection...</data></match></read>
    <read><delim>\x3d\x3d\x3d\x3d\x0a</delim><match><pcre>.*New Packet</pcre></match></read>
    <read><delim>\x3d\x3d\x3d\x0a</delim><match><pcre>.*===lol</pcre></match></read>
    <read><delim>\x3d\x3d\x3d\x0a</delim><match><pcre>.*===unexchangedsupraventricular</pcre></match></read>
    <read><delim>\x3d\x3d\x3d\x0a</delim><match><pcre>.*Dissection finished</pcre></match></read>
</replay>
</pov>
