<?xml version="1.0" standalone="no" ?>
<!DOCTYPE pov SYSTEM "/usr/share/cgc-docs/replay.dtd">
<pov>
<cbid>service</cbid>
<replay>
    <write><data>\x04\x04\x00\x00</data></write>
    <write><data>\x01\x00\x00\x00\x00\x00\x00\x00\xf0\x03\x00\x00\xe8\x03\x00\x00\x00\x00\x00\x00\x00\x00\x00\x00\xe8\x03\x00\x00\xb3\xcf\xb3\x0c\x2d9\x04\xe6J\xc0\xab\xce\x8d\x9c\x7do\xc2\x15zZf\x00\x00\x00\xdb\x1b\x0e\xfby\xc0i7\xdb\xc6A\xef\xf3\xb8ng\x0dTE\xc32\x91\x07\x8ey6i\xef\xe0\x0a\xee\x05\x97\xf4HA\x8c\x60\x86\xac\x02\x9a\xf4\x3cc\xe0Y9uV\xd2\x05\x40\x5f\x85\x00\xf8\x7d\x7f\x2f\xfc\x84\xfa\x5c\x159\xfa8\xdeg\x15p\x40O\xc8\x1e\xe3u\xb8\x9a\x2b\x09\xb31I\x9d\xea\xac.8b\xb4\xbd\xadj\xb4I\xc2\x16y\x28\x9f\x23\x12\x07\x2c\xa8eC\xda\x93\xfc9C\x23\x3cf\xaf\xd5\x97\x97\xebS\xbc\x1a\xfa\x91\x87\xac\xeb\x10\x0c\xd2hv\x1d\xect\x5f\x7e\xaa\xcd\x88\xc8\x18\x7b\x9e\x1a\x902\xd2\x84\xf2F\xec\xbc\xe6\x15\x0d\x0c\xd6l\x87KzU\xa8\xfa\xf6\x2b\x04\x12\x0d\xb6\xdb\x0e\x9c\xcb\x00R\xe0:\xe9\xd0\xdbj\xd0\x17fiS\xb0\x2b\x2c3\x9f\x0b\x2b\x07\xa7\x28\x9e\x04Zej\x5f\xf4f\x91\xac\xf9\xc7\xa0\xbb\xc3\x970\x8c\x5c\xc4\x3b\xdfS\x5f\xf6\x7d\xe6\xc3\x8d\x01:\x06F\xa3e\x7f\xac\xb0\xc2\x9eT\x26\x00\xa1\x08\x26\x10l\x8d\x7bkA\x7c\xefL\x0a\x5d\x04\x19s\x5e\x858\x9a\xe2\xcc\x3e\xfb6\x8d\x08e\xa2\x5d\xe5\xa9\x8f\x84K\xfd\x00E\xc5\x0b\x1e\xb1\xaa\xc8\xf1\xe6\xdeH\xea.rIP\x9eW\xb4\xb1:\xba\x90\x931\xee\x9f\x7d\x9c\x22\xdc\xf0\x1da\x8f\x04\x1b?w\x7e\xe0\x85\x5e?\xd7\xee\x85\xb0\x95\xfcq.\x1fYT\x84DB\x2c7\xe4\xd4\x3b\x14\x5ca\x1c\xfb\x40\x25v\x8eC\x02\xa8\x992\xe5\x15\xfaV\xb2\xf4N\x27\xa8\x8fk\xd0\xd0\xc1\xb8\xce\xe4\xd5\x0c\xdaPR\xafx\xf0\xbc\x18sr\x01.\xb3\xac\xe0\x8au\xf7\xda\x02\x26hB\x10\x7b\xbf\xc9K\xbe0\xb8\x2cH\xcc!\xf7\xb5\xa42\x23\xfd\x8a\xb9\xcd?z\x2d\x1c\x13\xa3r\x16\xa5M0\x8a\xbcC\x07\xce\xdf\x11\xafK\xec4\xdaMU\xcf\xa1y\xbb\x8fs\xaf\xd3M\x98\x29S\x08\x9d\xa6\x2a\x03k\x8dN3\xed\xcb\x60q\xf4\xd7\x87\xcd\xb4\xb9\x29\xccJoA\xa6\xc7\x24\x3dpK\xe6\x3c2\xdf\x13\xc7\xdb\x9c\x9d.\xfa\xb4U\x2f\x2b\x26\xeaZ\x92\xa5\x22\xec\xc1\xa7w\x8e\xc0\x00\xcd\x91\xe3\xc2\xfb2\x5f\xafz\xfe\x89\x95\xf1M\xe1\x1a\x1f\x0b\xb9\xa1\xb1!J\xc2wm\xea\xa0P\xd0\xeex\x82\xe4:\x7d\x3b\xd7c\xc6o\x9eo\xd0J\xc6X\xad\x93\xdc\xff\x12\x16\xd4\xa6\x7e\xe8C\x2d\x875\x07\xde\x3eMw\xbf0\xa4\xeb\x10\x0e\xb0\xec:\x82\xe2\xa2\xe2b\x17\xca\x7b\xeb\x96\xb9\xeb\x08\xd5\xda\x95\xed\xcf\xec\xa2G\x7b\x7d.\xda\xfa\xd9Ix\xe4\x2a\x1d\x29\x1d\xa2a\xaa\xc1\x91L\xcb\x16:\x2a\x9d\xf7:\xa9\xd8\xf6\xc1rA\xd9\xd2bg\xa9yQsN\xeb \x08\xa87\xc8\x5e\xc4\xc3\x03\x00s\x89\xfd\x04\x5e\xdc\xec\x3bb.\x7f\x25\xcf\x3b\x04C\x24\x83\xcb\x1d\x0dMO\xd4\x7c\x5f\xdf\x02\x3eu\x98\x8b\x22\xcc\xa0\xba\xaaK\x84?\x7eXu\x09\x07\x9cRv\xdc\xf3Ef\xf3\x8cQ\xfe\x7dE\xb5i\xf2\x0b\xc7\xa6\xf0\xa1\xf0\xab\x28M7\x02\x23\x0d\xbd\x5f\xf1\xddE\x03\x960\x9bL\xa9\x60\xd4J\xda0\x5c!.\xc6\x7e7\x9c\x94\xe6\x0f\x5b\xe8D\x83\x22\xf8\xf8\x06\x83\x85\xdcs\xaf\xe4\xea\x94\x7d\xde\x29\x7fx\xa6\xd1\xb8\x87\xd1\x17\x16\x03\xb2\x88\xa6\xc4\x7d\xfc\x40m\xb1\x9b\xb764\x87H\xe2\x2f\xb2I\x29\x04\x29\x3b4\x0f\x22\x5c\xae.G\x91\xec\xc3M\xb5\x83\x98\x88\x93L\x2br\x99\xbaUV\x9b\xb7\x80E5\x7dU\x27rpn\x90\xfb\x05\x95\x09\xf2\x8b\xf1\x81\xe7OFjv\x84\x0fC:l\xe32\x96\xf7q\xde\x82s\x04\xfeR\x951\x07\xdc\xc8\x90\x9e\xca\x7c\x8e\x8de\xfd\x7d:\xc9\xc8\xd6x\xae??\x12I\xbc\xb2\xd0vzb\x0d\x9d\xde\xd2\xae\xbb\xe6\x843\x40\xf1\x2cY\xe5\x01\x7f                                                 </data></write>
    <read><delim>\x0a</delim><match><data>Starting dissection...</data></match></read>
    <read><delim>\x3d\x3d\x3d\x3d\x0a</delim><match><pcre>.*New Packet</pcre></match></read>
    <read><delim>\x3d\x3d\x3d\x0a</delim><match><pcre>.*===rofl</pcre></match></read>
    <read><delim>\x3d\x3d\x3d\x0a</delim><match><pcre>.*===acanthopterygianMuranese</pcre></match></read>
    <read><delim>\x3d\x3d\x3d\x0a</delim><match><pcre>.*===tecalipalingenesy</pcre></match></read>
    <read><delim>\x3d\x3d\x3d\x0a</delim><match><pcre>.*Dissection finished</pcre></match></read>
</replay>
</pov>
