<?xml version="1.0" standalone="no" ?>
<!DOCTYPE pov SYSTEM "/usr/share/cgc-docs/replay.dtd">
<pov>
<cbid>service</cbid>
<replay>
    <write><data>\x16\x00\x00\x00robots only\xff\xff\xff\xff\xff\x9c\x0d\xd1i\xa5\xd2\xe63\x00\x00\x00\x00\x00\x00\x00\x00\x00\x00\x00\x00\x00\x00\x00\x00\x00\x00\x00\x00\x00\x00\x00\x00\x00\x00\x00\x00\x00\x00\x00\x00\x00\x00\x00\x00\x00\x00\x00\x00\x00\x00\x00\x00\x00\x00\x00\x00\x00\x00\x00\x00\x00\x00\x00\x00\x00\x00\x00\x00\x00\x00\x00\x00\x00\x00\x00\x00\x00\x00\x00\x00\x00\x00\x00\x00\x00\x00\x00\x00\x00\x00\x00\x00\x00\x00\x00\x00\x00\x00\x00\x00\x00\x00\x00\x00\x00\x00\x00\x00\x00\x00\x00\x00j\xe9m\xc8\xd8\xf3\xe5\xa3\xa6\xaa1\xd6\x22\xe6\x84\xc2nly\xff\xff\xff\xff\xff\x13!\x85\xdd\xa6\xdav\xa8\xb5\x2cU\xfe\xfb\xd8\x2c\x06\xf3U\xa4\xf7</data></write>
    <read><delim>\x0a</delim><match><data>This is not the function you\x27re looking for.</data></match></read>
</replay>
</pov>
