<?xml version="1.0" standalone="no" ?>
<!DOCTYPE pov SYSTEM "/usr/share/cgc-docs/replay.dtd">
<pov>
<cbid>service</cbid>
<replay>
    <write><data>\x00\x00\x00\x00\x00\x00\x00\x00\x00\x00\x00\x00\x00\x00\x00\x00\x00\x00\x00\x00\x00\x00\x00\x00\x00\x00\x00\x00\x00\x00\x00\x00\x00\x00\x00\x00\x00\x00\x00\x00\x00\x00\x00\x00\x00\x00\x00\x00\x00\x00\x00\x00\x00\x00\x00\x00\x00\x00\x00\x00\x00\x00\x00\x00\x00\x00\x00\x00\x00\x00\x00\x00\x00\x00\x00\x00\x00\x00\x00\x00\x00\x00\x00\x00\x00\x00\x00\x00\x00\x00\x00\x00\x00\x00\x00\x00\x00\x00\x00\x00\x00\x00\x00\x00\x00\x00\x00\x00\x00\x00\x00\x00\x00\x00\x00\x00\x00\x00\x00\x00\x00\x00\x00\x00\x00\x00\x00\x00\x00\x00\x00\x00\x00\x00\x00\x00\x00\x00\x00\x00\x00\x00\x00\x00\x00\x00\x00\x00\x00\x00\x00\x00\x00\x00\x00\x00\x00\x00\x00\x00\x00\x00\x00\x00\x00\x00\x00\x00\x00\x00\x00\x00\x00\x00\x00\x00\x00\x00\x00\x00\x00\x00\x00\x00\x00\x00\x00\x00\x00\x00\x00\x00\x00\x00\x00\x00\x00\x00\x00\x00\x00\x00\x00\x00\x00\x00\x00\x00\x00\x00\x00\x00\x00\x00\x00\x00\x00\x00\x00\x00\x00\x00\x00\x00\x00\x00\x00\x00\x00\x00\x00\x00\x00\x00\x00\x00\x00\x00\x00\x00\x00\x00\x00\x00\x00\x00\x00\x00\x00\x00\x00\x00\x00\x00\x00\x00</data></write>
    <read><length>256</length><match><data>\xff\xcc\xcc\xcc\xcc\xcc\xcc\xcc\xcc\xcc\xcc\xcc\xcc\xcc\xcc\xcc\xcc\xcc\xcc\xcc\xcc\xcc\xcc\xcc\xcc\xcc\xcc\xcc\xcc\xcc\xcc\xcc\xcc\xcc\xcc\xcc\xcc\xcc\xcc\xcc\xcc\xcc\xcc\xcc\xcc\xcc\xcc\xcc\xcc\xcc\xcc\xcc\xcc\xcc\xcc\xcc\xcc\xcc\xcc\xcc\xcc\xcc\xcc\xcc\xcc\xcc\xcc\xcc\xcc\xcc\xcc\xcc\xcc\xcc\xcc\xcc\xcc\xcc\xcc\xcc\xcc\xcc\xcc\xcc\xcc\xcc\xcc\xcc\xcc\xcc\xcc\xcc\xcc\xcc\xcc\xcc\xcc\xcc\xcc\xcc\xcc\xcc\xcc\xcc\xcc\xcc\xcc\xcc\xcc\xcc\xcc\xcc\xcc\xcc\xcc\xcc\xcc\xcc\xcc\xcc\xcc\xcc\xcc\xcc\xcc\xcc\xcc\xcc\xcc\xcc\xcc\xcc\xcc\xcc\xcc\xcc\xcc\xcc\xcc\xcc\xcc\xcc\xcc\xcc\xcc\xcc\xcc\xcc\xcc\xcc\xcc\xcc\xcc\xcc\xcc\xcc\xcc\xcc\xcc\xcc\xcc\xcc\xcc\xcc\xcc\xcc\xcc\xcc\xcc\xcc\xcc\xcc\xcc\xcc\xcc\xcc\xcc\xcc\xcc\xcc\xcc\xcc\xcc\xcc\xcc\xcc\xcc\xcc\xcc\xcc\xcc\xcc\xcc\xcc\xcc\xcc\xcc\xcc\xcc\xcc\xcc\xcc\xcc\xcc\xcc\xcc\xcc\xcc\xcc\xcc\xcc\xcc\xcc\xcc\xcc\xcc\xcc\xcc\xcc\xcc\xcc\xcc\xcc\xcc\xcc\xcc\xcc\xcc\xcc\xcc\xcc\xcc\xcc\xcc\xcc\xcc\xcc\xcc\xcc\xcc\xcc\xcc\xcc\xcc\xcc\xcc\xcc\xcc\xcc\xcc\xcc\xcc\xcc\xcc\xcc\xcc</data></match></read>
    <write><data>\xad\xaa\x5b\xc5qR\x261\xf1Ot\x92\x27\x14\x7e\x95</data></write>
    <read><length>16</length><match><data>\x00\x01\x02\x03\x04\x05\x06\x07\x08\x09\x0a\x0b\x0c\x0d\x0e\x0f</data></match></read>
    <write><data>\xf2j\x29 J\xce\xdc\x2f?z\x9e\x8a\xd6\xfc\xcb\x99\xdc\xfe\x05\x28\x0f\x19\x5c\xeb\x8e\x92\xa8\xb0\x2bxb\x17\x90\x8c\xe9E\x8c\x10\xfd\x98\xef\xb5\xa0\xd7\xd94\xe6\xa2\xfa\x88\x226\x3e\xfb\xf7a\xea\x04\x1e\xd4\x9f\x2f\x0d5\x2b\xda\xc4\xdc\xe5\x87\x1a\x60\xa5\x17\xe9\x89\x7bM\xe0\x9d\xea\x04\xea\xc8\xbeGBf\x3b\x96\xf6\xf6\xb1c\xf5\x26\x81\xa0\x27\x965\xe8\xa4\xe9z\x0a\xddQ\x0e\xf8.u\xa91\xf4\x17\x15\x1ce\x98\xebi\xe7\xc4O\x98\xc6\x60\x16W\x8f\xbc\x86\x2c\xcbQ\x98\x229\x3eO\xfb\xf3\x28\xe7\x0c\x88\xf6\xe1\xa7\x89\x3cW\xbe\x9f\xa87\x06\x81\x00\xa5\x84\xc8\x87\xef\xa5\x14\x7d\x0e\x5eMI \xf2\xe2Ix\x8d\x09r\xdc\x91\xdd\xf9DKsA\x93\x94\x9d\xb1f\x3b\xf5\xf3\x0e\xd8\x02\x89\x17\xfd8Z\x8d\x60\x9c\x02\xf7\xdde\x11\x7eQ\x12\xc3\x5f\xc0\xbf\xf7a\xf4\x9c\x96\xa9\xf5\x9f6aW\x14t\x2f\xdeT\xed\x19\x03\xf7\xa5\x5c\x80\xd5j\x29\xa8\x2amD\x86Uc\xf1k\x23\x0a</data></write>
    <read><length>112</length><match><data>\xc7\x83\x7b\x8f\x5em\x5c4\xd9\x40m\xce\x0cl\x1c\x82\xe8\xbao\xe7GlG5\xef\x60y\xa7\x0c\x0e\x1e\x82\xd6\xe7\x5f\x8234\x1dR\xd7hA\xe8\x2dEp\xbb\xd8\x9bL\xd0m7O\x7e\x91Y\x23\xbev6G\xab\xe2\x82W\xf9\x26e 1\xe52z\xccj\x5d\x5e\xdc\xd5\xa3\x29\x81:!gW\xcaAv\x85\x1fN\x1e\x97\xc8\xbb\x25\x94c\x0dG\x07\x90\x18\x60\xe6\x08\x40g\x96</data></match></read>
    <write><data>\xaa\xaa\xaa\xaa\xaa\xaa\xaa\xaa\xaa\xaa\xaa\xaa\xaa\xaa\xaa\xaa\xaa\xaa\xaa\xaa\xaa\xaa\xaa\xaa\xaa\xaa\xaa\xaa\xaa\xaa\xaa\xaa\xaa\xaa\xaa\xaa\xaa\xaa\xaa\xaa\xaa\xaa</data></write>
    <read><length>42</length><match><data>\xff\xaa\xaa\xaa\xaa\xaa\xaa\xaa\xaa\xaa\xaa\xaa\xaa\xaa\xaa\xaa\xaa\xaa\xaa\xaa\xaa\xaa\xaa\xaa\xaa\xaa\xaa\xaa\xaa\xaa\xaa\xaa\xaa\xaa\xaa\xaa\xaa\xaa\xaa\xaa\xaa\xaa</data></match></read>
</replay>
</pov>
